[
  {
    "id": "minnow",
    "name": "달팽이",
    "name_en": null,
    "level": 1,
    "tier": 1,
    "rarity": "common",
    "boss": false,
    "spawnWeight": null,
    "rewardMultiplier": null,
    "minTier": null,
    "profile": "swift",
    "shape": "snail",
    "stage": "brook",
    "dungeon": null,
    "lore": "느리지만 포기하지 않는다. 모든 모험가의 첫 상대.",
    "description": null,
    "behavior": null,
    "weakness": null,
    "stats": {
      "hp": 48,
      "attack": 5,
      "defense": 0,
      "exp": 9,
      "gold": 7
    },
    "drops": null,
    "tags": [
      "리스항구"
    ]
  },
  {
    "id": "carp",
    "name": "파란 달팽이",
    "name_en": null,
    "level": 2,
    "tier": 1,
    "rarity": "common",
    "boss": false,
    "spawnWeight": null,
    "rewardMultiplier": null,
    "minTier": null,
    "profile": "armored",
    "shape": "snail",
    "stage": "brook",
    "dungeon": null,
    "lore": "등껍질의 푸른빛은 바닷바람을 오래 맞은 흔적이다.",
    "description": null,
    "behavior": null,
    "weakness": null,
    "stats": {
      "hp": 62,
      "attack": 7,
      "defense": 1,
      "exp": 10,
      "gold": 8
    },
    "drops": null,
    "tags": [
      "리스항구"
    ]
  },
  {
    "id": "perch",
    "name": "빨간 달팽이",
    "name_en": null,
    "level": 3,
    "tier": 1,
    "rarity": "common",
    "boss": false,
    "spawnWeight": null,
    "rewardMultiplier": null,
    "minTier": null,
    "profile": "tidal",
    "shape": "snail",
    "stage": "brook",
    "dungeon": null,
    "lore": "달팽이 중에서는 성질이 가장 급하다.",
    "description": null,
    "behavior": null,
    "weakness": null,
    "stats": {
      "hp": 77,
      "attack": 10,
      "defense": 2,
      "exp": 12,
      "gold": 9
    },
    "drops": null,
    "tags": [
      "리스항구"
    ]
  },
  {
    "id": "mackerel",
    "name": "스포아",
    "name_en": null,
    "level": 5,
    "tier": 1,
    "rarity": "common",
    "boss": false,
    "spawnWeight": null,
    "rewardMultiplier": null,
    "minTier": null,
    "profile": "swift",
    "shape": "mushroom",
    "stage": "bay",
    "dungeon": null,
    "lore": "작은 버섯 포자가 뭉쳐 걸어 다닌다.",
    "description": null,
    "behavior": null,
    "weakness": null,
    "stats": {
      "hp": 111,
      "attack": 14,
      "defense": 4,
      "exp": 16,
      "gold": 11
    },
    "drops": null,
    "tags": [
      "리스항구"
    ]
  },
  {
    "id": "ray",
    "name": "슬라임",
    "name_en": null,
    "level": 6,
    "tier": 1,
    "rarity": "common",
    "boss": false,
    "spawnWeight": null,
    "rewardMultiplier": null,
    "minTier": null,
    "profile": "tidal",
    "shape": "slime",
    "stage": "bay",
    "dungeon": "grotto",
    "lore": "말랑한 몸으로 통통 튀며 다가온다. 얕보면 끈적하게 달라붙는다.",
    "description": null,
    "behavior": null,
    "weakness": null,
    "stats": {
      "hp": 130,
      "attack": 16,
      "defense": 4,
      "exp": 18,
      "gold": 12
    },
    "drops": null,
    "tags": [
      "리스항구"
    ]
  },
  {
    "id": "puffer",
    "name": "주황버섯",
    "name_en": null,
    "level": 7,
    "tier": 1,
    "rarity": "common",
    "boss": false,
    "spawnWeight": null,
    "rewardMultiplier": null,
    "minTier": null,
    "profile": "venom",
    "shape": "mushroom",
    "stage": "bay",
    "dungeon": null,
    "lore": "건드리면 머리를 들이받는다. 겁을 먹을수록 더 세게.",
    "description": null,
    "behavior": null,
    "weakness": null,
    "stats": {
      "hp": 151,
      "attack": 18,
      "defense": 5,
      "exp": 21,
      "gold": 14
    },
    "drops": null,
    "tags": [
      "리스항구"
    ]
  },
  {
    "id": "lionfish",
    "name": "돼지",
    "name_en": null,
    "level": 10,
    "tier": 1,
    "rarity": "common",
    "boss": false,
    "spawnWeight": null,
    "rewardMultiplier": null,
    "minTier": null,
    "profile": "venom",
    "shape": "pig",
    "stage": "reef",
    "dungeon": null,
    "lore": "해변을 뛰노는 돼지. 꼬리가 불꽃처럼 바짝 섰다.",
    "description": null,
    "behavior": null,
    "weakness": null,
    "stats": {
      "hp": 220,
      "attack": 25,
      "defense": 8,
      "exp": 32,
      "gold": 19
    },
    "drops": null,
    "tags": [
      "헤네시스"
    ]
  },
  {
    "id": "eel",
    "name": "리본 돼지",
    "name_en": null,
    "level": 12,
    "tier": 2,
    "rarity": "common",
    "boss": false,
    "spawnWeight": null,
    "rewardMultiplier": null,
    "minTier": null,
    "profile": "arcane",
    "shape": "pig",
    "stage": "reef",
    "dungeon": "grotto",
    "lore": "리본을 달아도 몸통 박치기는 번개처럼 빠르다.",
    "description": null,
    "behavior": null,
    "weakness": null,
    "stats": {
      "hp": 273,
      "attack": 29,
      "defense": 9,
      "exp": 42,
      "gold": 24
    },
    "drops": null,
    "tags": [
      "헤네시스"
    ]
  },
  {
    "id": "barracuda",
    "name": "초록버섯",
    "name_en": null,
    "level": 14,
    "tier": 2,
    "rarity": "common",
    "boss": false,
    "spawnWeight": null,
    "rewardMultiplier": null,
    "minTier": null,
    "profile": "swift",
    "shape": "mushroom",
    "stage": "reef",
    "dungeon": null,
    "lore": "단 한 번 뛰어올라 덮치고 끝낸다.",
    "description": null,
    "behavior": null,
    "weakness": null,
    "stats": {
      "hp": 330,
      "attack": 34,
      "defense": 11,
      "exp": 55,
      "gold": 31
    },
    "drops": null,
    "tags": [
      "헤네시스"
    ]
  },
  {
    "id": "ghost",
    "name": "와일드보어",
    "name_en": null,
    "level": 18,
    "tier": 2,
    "rarity": "common",
    "boss": false,
    "spawnWeight": null,
    "rewardMultiplier": null,
    "minTier": null,
    "profile": "arcane",
    "shape": "boar",
    "stage": "wreck",
    "dungeon": "cemetery",
    "lore": "발굴지 수로를 따라 거칠게 내달리는 멧돼지.",
    "description": null,
    "behavior": null,
    "weakness": null,
    "stats": {
      "hp": 462,
      "attack": 43,
      "defense": 14,
      "exp": 97,
      "gold": 48
    },
    "drops": null,
    "tags": [
      "페리온"
    ]
  },
  {
    "id": "angler",
    "name": "스켈레톤 솔저",
    "name_en": null,
    "level": 20,
    "tier": 2,
    "rarity": "common",
    "boss": false,
    "spawnWeight": null,
    "rewardMultiplier": null,
    "minTier": null,
    "profile": "arcane",
    "shape": "skeleton",
    "stage": "wreck",
    "dungeon": null,
    "lore": "발굴지에서 깨어난 해골 병사. 등불에 이끌리면 끝이다.",
    "description": null,
    "behavior": null,
    "weakness": null,
    "stats": {
      "hp": 535,
      "attack": 47,
      "defense": 16,
      "exp": 128,
      "gold": 60
    },
    "drops": null,
    "tags": [
      "페리온"
    ]
  },
  {
    "id": "shark",
    "name": "스톤골렘",
    "name_en": null,
    "level": 22,
    "tier": 3,
    "rarity": "common",
    "boss": false,
    "spawnWeight": null,
    "rewardMultiplier": null,
    "minTier": null,
    "profile": "armored",
    "shape": "golem",
    "stage": "wreck",
    "dungeon": "cemetery",
    "lore": "유적의 돌을 먹고 자란 거인.",
    "description": null,
    "behavior": null,
    "weakness": null,
    "stats": {
      "hp": 614,
      "attack": 51,
      "defense": 17,
      "exp": 169,
      "gold": 76
    },
    "drops": null,
    "tags": [
      "페리온"
    ]
  },
  {
    "id": "viper",
    "name": "이블아이",
    "name_en": null,
    "level": 26,
    "tier": 3,
    "rarity": "common",
    "boss": false,
    "spawnWeight": null,
    "rewardMultiplier": null,
    "minTier": null,
    "profile": "venom",
    "shape": "eye",
    "stage": "trench",
    "dungeon": "temple",
    "lore": "늪 속에서 눈보다 송곳니가 먼저 빛난다.",
    "description": null,
    "behavior": null,
    "weakness": null,
    "stats": {
      "hp": 786,
      "attack": 60,
      "defense": 20,
      "exp": 296,
      "gold": 119
    },
    "drops": null,
    "tags": [
      "엘리니아"
    ]
  },
  {
    "id": "squid",
    "name": "커즈아이",
    "name_en": null,
    "level": 28,
    "tier": 3,
    "rarity": "common",
    "boss": false,
    "spawnWeight": null,
    "rewardMultiplier": null,
    "minTier": null,
    "profile": "arcane",
    "shape": "eye",
    "stage": "trench",
    "dungeon": null,
    "lore": "숲의 오래된 저주를 눈 하나에 담았다.",
    "description": null,
    "behavior": null,
    "weakness": null,
    "stats": {
      "hp": 881,
      "attack": 65,
      "defense": 22,
      "exp": 392,
      "gold": 149
    },
    "drops": null,
    "tags": [
      "엘리니아"
    ]
  },
  {
    "id": "leviathan",
    "name": "콜드아이",
    "name_en": null,
    "level": 30,
    "tier": 3,
    "rarity": "common",
    "boss": false,
    "spawnWeight": null,
    "rewardMultiplier": null,
    "minTier": null,
    "profile": "armored",
    "shape": "eye",
    "stage": "trench",
    "dungeon": null,
    "lore": "늪 바닥의 냉기를 먹고 자란 거대한 눈.",
    "description": null,
    "behavior": null,
    "weakness": null,
    "stats": {
      "hp": 980,
      "attack": 69,
      "defense": 24,
      "exp": 518,
      "gold": 187
    },
    "drops": null,
    "tags": [
      "엘리니아"
    ]
  },
  {
    "id": "moonfish",
    "name": "루팡",
    "name_en": null,
    "level": 32,
    "tier": 4,
    "rarity": "common",
    "boss": false,
    "spawnWeight": null,
    "rewardMultiplier": null,
    "minTier": null,
    "profile": "arcane",
    "shape": "monkey",
    "stage": "moon",
    "dungeon": "abyss",
    "lore": "달빛 호숫가 나무 위에서 바나나를 던진다.",
    "description": null,
    "behavior": null,
    "weakness": null,
    "stats": {
      "hp": 1085,
      "attack": 73,
      "defense": 25,
      "exp": 685,
      "gold": 235
    },
    "drops": null,
    "tags": [
      "엘리니아"
    ]
  },
  {
    "id": "dragon",
    "name": "좀비 루팡",
    "name_en": null,
    "level": 36,
    "tier": 4,
    "rarity": "common",
    "boss": false,
    "spawnWeight": null,
    "rewardMultiplier": null,
    "minTier": null,
    "profile": "swift",
    "shape": "monkey",
    "stage": "moon",
    "dungeon": "abyss",
    "lore": "죽어서도 바나나를 놓지 않는다.",
    "description": null,
    "behavior": null,
    "weakness": null,
    "stats": {
      "hp": 1309,
      "attack": 82,
      "defense": 28,
      "exp": 1199,
      "gold": 370
    },
    "drops": null,
    "tags": [
      "엘리니아"
    ]
  },
  {
    "id": "ancient",